[
  {
    "schemaVersion": "1.0.0",
    "sampleId": "syn-weed-covered-0",
    "task": "weed_photo",
    "split": "test",
    "clusterId": "cluster-syn-weed-covered-0",
    "contentSha256": "e21014c8e0d006d8bcb1edb4a95dc97e156e620922021870e326e4bda9528666",
    "rawMediaSha256": "e21014c8e0d006d8bcb1edb4a95dc97e156e620922021870e326e4bda9528666",
    "sourceKind": "synthetic_placeholder",
    "sourceRef": "synthetic:generated:for-program-validation-only",
    "coverage": "covered",
    "quality": "clear",
    "gold": {
      "speciesId": "SYN_SPECIES_A"
    },
    "annotation": {
      "method": "synthetic_placeholder",
      "annotatorRef": "synthetic-fixture-generator",
      "modelGenerated": false
    },
    "rawMediaCommitted": false,
    "labelClass": "SYN_SPECIES_A"
  },
  {
    "schemaVersion": "1.0.0",
    "sampleId": "syn-weed-covered-1",
    "task": "weed_photo",
    "split": "test",
    "clusterId": "cluster-syn-weed-covered-1",
    "contentSha256": "172fbca9fb9ee8f1f6701afe274738e872f09b856b0dbe7b0af0ff89e8a8bc39",
    "rawMediaSha256": "172fbca9fb9ee8f1f6701afe274738e872f09b856b0dbe7b0af0ff89e8a8bc39",
    "sourceKind": "synthetic_placeholder",
    "sourceRef": "synthetic:generated:for-program-validation-only",
    "coverage": "covered",
    "quality": "clear",
    "gold": {
      "speciesId": "SYN_SPECIES_B"
    },
    "annotation": {
      "method": "synthetic_placeholder",
      "annotatorRef": "synthetic-fixture-generator",
      "modelGenerated": false
    },
    "rawMediaCommitted": false,
    "labelClass": "SYN_SPECIES_B"
  },
  {
    "schemaVersion": "1.0.0",
    "sampleId": "syn-weed-covered-2",
    "task": "weed_photo",
    "split": "test",
    "clusterId": "cluster-syn-weed-covered-2",
    "contentSha256": "f0533c6110291df0a8e3bd85b0205116f9088a135482c0061a25b16ead9e6bcb",
    "rawMediaSha256": "f0533c6110291df0a8e3bd85b0205116f9088a135482c0061a25b16ead9e6bcb",
    "sourceKind": "synthetic_placeholder",
    "sourceRef": "synthetic:generated:for-program-validation-only",
    "coverage": "covered",
    "quality": "clear",
    "gold": {
      "speciesId": "SYN_SPECIES_A"
    },
    "annotation": {
      "method": "synthetic_placeholder",
      "annotatorRef": "synthetic-fixture-generator",
      "modelGenerated": false
    },
    "rawMediaCommitted": false,
    "labelClass": "SYN_SPECIES_A"
  },
  {
    "schemaVersion": "1.0.0",
    "sampleId": "syn-weed-covered-3",
    "task": "weed_photo",
    "split": "test",
    "clusterId": "cluster-syn-weed-covered-3",
    "contentSha256": "f98a7013f531be9d6b382785cb9f86de0af5ccc2bb533a4f27aad2758c4fb7fb",
    "rawMediaSha256": "f98a7013f531be9d6b382785cb9f86de0af5ccc2bb533a4f27aad2758c4fb7fb",
    "sourceKind": "synthetic_placeholder",
    "sourceRef": "synthetic:generated:for-program-validation-only",
    "coverage": "covered",
    "quality": "clear",
    "gold": {
      "speciesId": "SYN_SPECIES_B"
    },
    "annotation": {
      "method": "synthetic_placeholder",
      "annotatorRef": "synthetic-fixture-generator",
      "modelGenerated": false
    },
    "rawMediaCommitted": false,
    "labelClass": "SYN_SPECIES_B"
  },
  {
    "schemaVersion": "1.0.0",
    "sampleId": "syn-weed-covered-4",
    "task": "weed_photo",
    "split": "test",
    "clusterId": "cluster-syn-weed-covered-4",
    "contentSha256": "42226abdb0e85be59b139bef02b3a0a717f057f44d8fc735baf9e8ca28a1a587",
    "rawMediaSha256": "42226abdb0e85be59b139bef02b3a0a717f057f44d8fc735baf9e8ca28a1a587",
    "sourceKind": "synthetic_placeholder",
    "sourceRef": "synthetic:generated:for-program-validation-only",
    "coverage": "covered",
    "quality": "clear",
    "gold": {
      "speciesId": "SYN_SPECIES_A"
    },
    "annotation": {
      "method": "synthetic_placeholder",
      "annotatorRef": "synthetic-fixture-generator",
      "modelGenerated": false
    },
    "rawMediaCommitted": false,
    "labelClass": "SYN_SPECIES_A"
  },
  {
    "schemaVersion": "1.0.0",
    "sampleId": "syn-weed-covered-5",
    "task": "weed_photo",
    "split": "test",
    "clusterId": "cluster-syn-weed-covered-5",
    "contentSha256": "1c49618b7e221010a6da608f3dba6069424d6a79d243593c397c193dbef073b3",
    "rawMediaSha256": "1c49618b7e221010a6da608f3dba6069424d6a79d243593c397c193dbef073b3",
    "sourceKind": "synthetic_placeholder",
    "sourceRef": "synthetic:generated:for-program-validation-only",
    "coverage": "covered",
    "quality": "clear",
    "gold": {
      "speciesId": "SYN_SPECIES_B"
    },
    "annotation": {
      "method": "synthetic_placeholder",
      "annotatorRef": "synthetic-fixture-generator",
      "modelGenerated": false
    },
    "rawMediaCommitted": false,
    "labelClass": "SYN_SPECIES_B"
  },
  {
    "schemaVersion": "1.0.0",
    "sampleId": "syn-weed-covered-6",
    "task": "weed_photo",
    "split": "test",
    "clusterId": "cluster-syn-weed-covered-6",
    "contentSha256": "c28fc9b3c31fcc11cc0fa9783c42dec2f2179a8edaf5e069ce77f315777e06b2",
    "rawMediaSha256": "c28fc9b3c31fcc11cc0fa9783c42dec2f2179a8edaf5e069ce77f315777e06b2",
    "sourceKind": "synthetic_placeholder",
    "sourceRef": "synthetic:generated:for-program-validation-only",
    "coverage": "covered",
    "quality": "clear",
    "gold": {
      "speciesId": "SYN_SPECIES_A"
    },
    "annotation": {
      "method": "synthetic_placeholder",
      "annotatorRef": "synthetic-fixture-generator",
      "modelGenerated": false
    },
    "rawMediaCommitted": false,
    "labelClass": "SYN_SPECIES_A"
  },
  {
    "schemaVersion": "1.0.0",
    "sampleId": "syn-weed-covered-7",
    "task": "weed_photo",
    "split": "test",
    "clusterId": "cluster-syn-weed-covered-7",
    "contentSha256": "c03ef2880b058f50b31b69d570d45c0a5be2682dd2a264d603f0d433296cbfe1",
    "rawMediaSha256": "c03ef2880b058f50b31b69d570d45c0a5be2682dd2a264d603f0d433296cbfe1",
    "sourceKind": "synthetic_placeholder",
    "sourceRef": "synthetic:generated:for-program-validation-only",
    "coverage": "covered",
    "quality": "clear",
    "gold": {
      "speciesId": "SYN_SPECIES_B"
    },
    "annotation": {
      "method": "synthetic_placeholder",
      "annotatorRef": "synthetic-fixture-generator",
      "modelGenerated": false
    },
    "rawMediaCommitted": false,
    "labelClass": "SYN_SPECIES_B"
  },
  {
    "schemaVersion": "1.0.0",
    "sampleId": "syn-weed-ooc-0",
    "task": "weed_photo",
    "split": "test",
    "clusterId": "cluster-syn-weed-ooc-0",
    "contentSha256": "9e2cf1c6c422d0d348e4d6a1ec4f2382f6adcc97b3e7f07cd79c98b61915eca6",
    "rawMediaSha256": "9e2cf1c6c422d0d348e4d6a1ec4f2382f6adcc97b3e7f07cd79c98b61915eca6",
    "sourceKind": "synthetic_placeholder",
    "sourceRef": "synthetic:generated:for-program-validation-only",
    "coverage": "out_of_coverage",
    "quality": "clear",
    "gold": {
      "speciesId": null,
      "expected": "not_supported"
    },
    "annotation": {
      "method": "synthetic_placeholder",
      "annotatorRef": "synthetic-fixture-generator",
      "modelGenerated": false
    },
    "rawMediaCommitted": false,
    "labelClass": "uncovered_object"
  },
  {
    "schemaVersion": "1.0.0",
    "sampleId": "syn-weed-ooc-1",
    "task": "weed_photo",
    "split": "test",
    "clusterId": "cluster-syn-weed-ooc-1",
    "contentSha256": "343d73e35b598350e2c30ef515e83f234f7d7b225df400c110aa0a1bd5cebdd3",
    "rawMediaSha256": "343d73e35b598350e2c30ef515e83f234f7d7b225df400c110aa0a1bd5cebdd3",
    "sourceKind": "synthetic_placeholder",
    "sourceRef": "synthetic:generated:for-program-validation-only",
    "coverage": "out_of_coverage",
    "quality": "clear",
    "gold": {
      "speciesId": null,
      "expected": "not_supported"
    },
    "annotation": {
      "method": "synthetic_placeholder",
      "annotatorRef": "synthetic-fixture-generator",
      "modelGenerated": false
    },
    "rawMediaCommitted": false,
    "labelClass": "uncovered_object"
  },
  {
    "schemaVersion": "1.0.0",
    "sampleId": "syn-weed-ooc-2",
    "task": "weed_photo",
    "split": "test",
    "clusterId": "cluster-syn-weed-ooc-2",
    "contentSha256": "c453b1593ff1b6e15ceae4df3bf8ea7141a010a5fffdb744e0c7ff843ca30623",
    "rawMediaSha256": "c453b1593ff1b6e15ceae4df3bf8ea7141a010a5fffdb744e0c7ff843ca30623",
    "sourceKind": "synthetic_placeholder",
    "sourceRef": "synthetic:generated:for-program-validation-only",
    "coverage": "out_of_coverage",
    "quality": "clear",
    "gold": {
      "speciesId": null,
      "expected": "not_supported"
    },
    "annotation": {
      "method": "synthetic_placeholder",
      "annotatorRef": "synthetic-fixture-generator",
      "modelGenerated": false
    },
    "rawMediaCommitted": false,
    "labelClass": "uncovered_object"
  },
  {
    "schemaVersion": "1.0.0",
    "sampleId": "syn-weed-ooc-3",
    "task": "weed_photo",
    "split": "test",
    "clusterId": "cluster-syn-weed-ooc-3",
    "contentSha256": "9674c259f1efa7958ce0a991dc8756da98b141d86ac8e22adaece195ff655261",
    "rawMediaSha256": "9674c259f1efa7958ce0a991dc8756da98b141d86ac8e22adaece195ff655261",
    "sourceKind": "synthetic_placeholder",
    "sourceRef": "synthetic:generated:for-program-validation-only",
    "coverage": "out_of_coverage",
    "quality": "clear",
    "gold": {
      "speciesId": null,
      "expected": "not_supported"
    },
    "annotation": {
      "method": "synthetic_placeholder",
      "annotatorRef": "synthetic-fixture-generator",
      "modelGenerated": false
    },
    "rawMediaCommitted": false,
    "labelClass": "uncovered_object"
  },
  {
    "schemaVersion": "1.0.0",
    "sampleId": "syn-weed-low-0",
    "task": "weed_photo",
    "split": "test",
    "clusterId": "cluster-syn-weed-low-0",
    "contentSha256": "bccff1e9f00f7c88ef0d9519dd1426c1fe732a017daa1168862577b1229ed6a9",
    "rawMediaSha256": "bccff1e9f00f7c88ef0d9519dd1426c1fe732a017daa1168862577b1229ed6a9",
    "sourceKind": "synthetic_placeholder",
    "sourceRef": "synthetic:generated:for-program-validation-only",